{
  "$schema": "https://json-schema.org/draft/2020-12/schema",
  "$id": "https://github.com/jewzaam/jewzaam-reviews/skills/review/schemas/agent-output.schema.json",
  "title": "Agent Output",
  "description": "JSON contract returned by a single review sub-agent for one (concern, dimension) cell.",
  "type": "object",
  "additionalProperties": false,
  "required": [
    "agent_id",
    "concern",
    "concern_slug",
    "dimension_name",
    "dimension_slug",
    "dimension_scope",
    "findings",
    "cross_cutting_observations"
  ],
  "properties": {
    "agent_id": {
      "type": "string",
      "pattern": "^[\\s\\S]+$",
      "description": "Stable identifier for the sub-agent instance (e.g. 'architecture/auth'). Used for logging and issues[].source_component attribution."
    },
    "concern": {
      "type": "string",
      "description": "Human-readable concern axis. One of the seven fixed axes the review skill dispatches per dimension.",
      "enum": [
        "Architecture and Design",
        "Implementation Quality",
        "Test Quality and Coverage",
        "Maintainability and Standards",
        "Security",
        "Backwards Compatibility",
        "Documentation",
        "Observability"
      ]
    },
    "concern_slug": {
      "type": "string",
      "description": "Machine-readable concern axis (kebab-case). Must match the human `concern` value.",
      "enum": [
        "architecture",
        "implementation",
        "test",
        "maintainability",
        "security",
        "compatibility",
        "documentation",
        "observability"
      ]
    },
    "dimension_name": {
      "type": "string",
      "pattern": "^[\\s\\S]+$",
      "description": "Human-readable name of the dimension being reviewed (e.g. 'auth subsystem')."
    },
    "dimension_slug": {
      "type": "string",
      "pattern": "^[a-z0-9][a-z0-9-]{0,30}$",
      "description": "Filesystem-safe dimension slug (lowercase kebab-case, <=30 chars). Used in raw/<concern_slug>-<dimension_slug>.json."
    },
    "dimension_scope": {
      "type": "object",
      "additionalProperties": false,
      "description": "Scope descriptor for one review dimension. Closed rather than free-form: OpenAI strict Structured Outputs rejects an open object, and only `shared_infrastructure` is read by name (orchestrator/prompts.py) \u2014 the rest is serialized whole into the lens prompt and the report. null means not set.",
      "required": [
        "paths",
        "theme",
        "shared_infrastructure"
      ],
      "properties": {
        "paths": {
          "anyOf": [
            {
              "type": "array",
              "items": {
                "type": "string"
              }
            },
            {
              "type": "null"
            }
          ],
          "description": "Repo-relative paths this dimension covers."
        },
        "theme": {
          "anyOf": [
            {
              "type": "string"
            },
            {
              "type": "null"
            }
          ],
          "description": "Short thematic description when the dimension is not path-scoped."
        },
        "shared_infrastructure": {
          "anyOf": [
            {
              "type": "boolean"
            },
            {
              "type": "null"
            }
          ],
          "description": "True when the dimension covers code shared across other dimensions; alters the lens prompt."
        }
      }
    },
    "findings": {
      "type": "array",
      "description": "Findings detected by this agent within its (concern, dimension) cell. May be empty.",
      "items": {
        "$ref": "#/$defs/finding"
      }
    },
    "cross_cutting_observations": {
      "type": "array",
      "description": "Informational notes about patterns or issues outside the agent's dimension scope. Not scored, not rendered as findings.",
      "items": {
        "type": "string"
      }
    }
  },
  "$defs": {
    "finding": {
      "type": "object",
      "additionalProperties": false,
      "required": [
        "title",
        "runtime_scope",
        "runtime_scope_justification",
        "failure_mode",
        "failure_mode_justification",
        "evidence_quality",
        "evidence_quality_justification",
        "trace_origin",
        "trace_origin_justification",
        "effort_to_fix",
        "effort_to_fix_justification",
        "locations",
        "issue",
        "why_it_matters",
        "suggested_fix"
      ],
      "properties": {
        "title": {
          "type": "string",
          "pattern": "^[\\s\\S]+$",
          "description": "Short human-readable title for the finding (<=120 chars)."
        },
        "runtime_scope": {
          "$ref": "https://github.com/jewzaam/jewzaam-reviews/schemas/findings.schema.json#/$defs/runtime_scope"
        },
        "runtime_scope_justification": {
          "$ref": "https://github.com/jewzaam/jewzaam-reviews/schemas/findings.schema.json#/$defs/runtime_scope_justification"
        },
        "failure_mode": {
          "$ref": "https://github.com/jewzaam/jewzaam-reviews/schemas/findings.schema.json#/$defs/failure_mode"
        },
        "failure_mode_justification": {
          "$ref": "https://github.com/jewzaam/jewzaam-reviews/schemas/findings.schema.json#/$defs/failure_mode_justification"
        },
        "evidence_quality": {
          "$ref": "https://github.com/jewzaam/jewzaam-reviews/schemas/findings.schema.json#/$defs/evidence_quality"
        },
        "evidence_quality_justification": {
          "$ref": "https://github.com/jewzaam/jewzaam-reviews/schemas/findings.schema.json#/$defs/evidence_quality_justification"
        },
        "trace_origin": {
          "$ref": "https://github.com/jewzaam/jewzaam-reviews/schemas/findings.schema.json#/$defs/trace_origin"
        },
        "trace_origin_justification": {
          "$ref": "https://github.com/jewzaam/jewzaam-reviews/schemas/findings.schema.json#/$defs/trace_origin_justification"
        },
        "effort_to_fix": {
          "$ref": "https://github.com/jewzaam/jewzaam-reviews/schemas/findings.schema.json#/$defs/effort_to_fix"
        },
        "effort_to_fix_justification": {
          "$ref": "https://github.com/jewzaam/jewzaam-reviews/schemas/findings.schema.json#/$defs/effort_to_fix_justification"
        },
        "locations": {
          "type": "array",
          "minItems": 1,
          "description": "File+line pointers that anchor the finding. At least one entry required; the first (or role='primary') entry is the canonical location used for grouping and rendering.",
          "items": {
            "$ref": "#/$defs/location"
          }
        },
        "issue": {
          "type": "string",
          "pattern": "^[\\s\\S]+$",
          "description": "1-3 sentence prose description of the problem."
        },
        "why_it_matters": {
          "type": "string",
          "pattern": "^[\\s\\S]+$",
          "description": "Prose grounding the finding in the project's own patterns, standards, or stated requirements."
        },
        "suggested_fix": {
          "type": "string",
          "pattern": "^[\\s\\S]+$",
          "description": "Prose describing the recommended change."
        }
      }
    },
    "location": {
      "type": "object",
      "additionalProperties": false,
      "required": [
        "path",
        "line",
        "role"
      ],
      "properties": {
        "path": {
          "type": "string",
          "pattern": "^[\\s\\S]+$",
          "description": "Repo-relative file path (POSIX separators)."
        },
        "line": {
          "type": "string",
          "pattern": "^[0-9]+(-[0-9]+)?$",
          "description": "Line number or inclusive range (e.g. '12' or '12-20'). Stored as a string so ranges are allowed."
        },
        "role": {
          "anyOf": [
            {
              "type": "string",
              "description": "primary = canonical location for this finding; related = supporting evidence elsewhere; callsite = where the issue is invoked; requirement = spec/standards file:line that states the requirement being violated. Defaults to primary when absent.",
              "enum": [
                "primary",
                "related",
                "callsite",
                "requirement"
              ]
            },
            {
              "type": "null"
            }
          ]
        }
      }
    }
  }
}
