{
  "agent_id": "architecture-auth-001",
  "concern": "Architecture and Design",
  "concern_slug": "architecture",
  "dimension_name": "auth subsystem",
  "dimension_slug": "auth",
  "dimension_scope": {
    "paths": [
      "src/auth/"
    ],
    "shared_infrastructure": null,
    "theme": null
  },
  "findings": [
    {
      "title": "AuthService bypasses repository abstraction",
      "runtime_scope": "service-internal",
      "runtime_scope_justification": "src/auth/service.py is application code running at production runtime, accessed only by internal services.",
      "failure_mode": "degraded-behavior",
      "failure_mode_justification": "Bypassing the repository means queries skip caching and audit logging, producing stale or untracked data access.",
      "evidence_quality": "demonstrated",
      "evidence_quality_justification": "Lines 42-58 show a direct DB query via sqlalchemy session; AuthRepository.get_user() at repo.py:10 provides the intended abstraction.",
      "trace_origin": "component",
      "trace_origin_justification": "Traced within auth module: AuthService.authenticate() calls session.query() directly instead of AuthRepository.get_user().",
      "effort_to_fix": "small",
      "effort_to_fix_justification": "Inject AuthRepository into AuthService and replace the direct query with repo.get_user().",
      "locations": [
        {
          "path": "src/auth/service.py",
          "line": "42-58",
          "role": "primary"
        },
        {
          "path": "src/auth/repo.py",
          "line": "10",
          "role": "related"
        }
      ],
      "issue": "AuthService reads the database directly instead of going through AuthRepository.",
      "why_it_matters": "All other services route DB access through repositories per the project's stated architecture (CLAUDE.md).",
      "suggested_fix": "Inject AuthRepository into AuthService and replace the direct query with repo.get_user()."
    }
  ],
  "cross_cutting_observations": []
}
